{
  "schema": "officegen.acceptance-suite@1.0",
  "suiteId": "officegen-v2.6.0-ai-office-operation-os",
  "release": "2.6.0",
  "contract": "office-operation-os-v2.6.0.goal.json",
  "blockingPolicy": {
    "mustPass": "Every blocking test covering a MUST requirement must pass before tagging v2.6.0.",
    "manualEvidenceAllowed": "Manual evidence is allowed only for platform-dependent native renderer checks and must include reviewer notes.",
    "knownLimitationRule": "Known limitations are acceptable only when machine-readable warnings, remediation entries, and user-facing docs disclose them."
  },
  "tests": [
    {
      "id": "A001",
      "title": "Agent capability contract snapshot",
      "kind": "contract",
      "requirementIds": ["G01-R01"],
      "formats": ["json"],
      "fixtures": ["current checkout"],
      "steps": [
        {
          "run": "npm run contract:check",
          "expect": "Command metadata, core capabilities, registered commands, aliases, and wired-command exposure are consistent."
        },
        {
          "run": "officegen capabilities --agent --json",
          "expect": "JSON includes command groups, profiles, limitations, and disabled capability policy."
        }
      ],
      "passCriteria": [
        "No command group is documented in only one of core capabilities or CLI metadata.",
        "No agent-visible command emits an implementation placeholder."
      ],
      "evidence": ["contract-check.txt", "capabilities.agent.json"],
      "automation": "required",
      "blocking": true
    },
    {
      "id": "A002",
      "title": "Help and workflow discovery",
      "kind": "cli",
      "requirementIds": ["G01-R01", "G06-R03", "G10-R02"],
      "formats": ["json"],
      "fixtures": ["current checkout"],
      "steps": [
        {
          "run": "officegen help --agent --json",
          "expect": "JSON help exposes top-level commands and machine-readable descriptions."
        },
        {
          "run": "officegen help workflow inspect-edit-export --agent --json",
          "expect": "Workflow help describes inspect, view, dry-run edit, apply, diff, and verify loop."
        }
      ],
      "passCriteria": [
        "Help output includes enough structured fields for an agent to choose the next command.",
        "Workflow guidance has no source-only or README-only dependency."
      ],
      "evidence": ["help.agent.json", "help.workflow.inspect-edit-export.json"],
      "automation": "required",
      "blocking": true
    },
    {
      "id": "A003",
      "title": "Schema registry coverage",
      "kind": "contract",
      "requirementIds": ["G01-R02"],
      "formats": ["json"],
      "fixtures": ["schema registry"],
      "steps": [
        {
          "run": "npm run schema:coverage",
          "expect": "Runtime schema literals and implemented edit ops are represented in the schema registry."
        },
        {
          "run": "officegen schema list --json && officegen schema get officegen.capabilities@1.2 --json",
          "expect": "Schema list and get return valid JSON with stable schema IDs."
        }
      ],
      "passCriteria": [
        "Every representative result schema is registered.",
        "Every implemented edit operation is present in the edit operation schema."
      ],
      "evidence": ["schema-coverage.txt", "schema-list.json", "schema-capabilities.json"],
      "automation": "required",
      "blocking": true
    },
    {
      "id": "A004",
      "title": "Structured error and recovery evidence",
      "kind": "cli",
      "requirementIds": ["G01-R03", "G10-R02"],
      "formats": ["json"],
      "fixtures": ["missing input file", "invalid schema payload", "unsupported command mode"],
      "steps": [
        {
          "run": "officegen errors --json",
          "expect": "Error catalog includes stable codes, categories, recoverability, and recovery hints."
        },
        {
          "run": "officegen inspect does-not-exist.pptx --agent --json",
          "expect": "Failure envelope includes code, message, hint, and redacted context."
        }
      ],
      "passCriteria": [
        "Negative commands return non-zero exit codes.",
        "Error JSON is parseable and includes recovery guidance without leaking secrets."
      ],
      "evidence": ["errors.catalog.json", "negative.missing-file.json"],
      "automation": "required",
      "blocking": true
    },
    {
      "id": "A005",
      "title": "Cross-format inspection maps",
      "kind": "e2e",
      "requirementIds": ["G02-R01", "G02-R03"],
      "formats": ["pptx", "docx", "xlsx", "pdf"],
      "fixtures": ["representative pptx", "representative docx", "representative xlsx", "representative pdf", "hostile metadata fixture"],
      "steps": [
        {
          "run": "officegen inspect <fixture> --depth summary --agent --json",
          "expect": "Inspection returns object map, warnings, trust markers, and format-specific summaries."
        }
      ],
      "passCriteria": [
        "Every supported format has at least one stable object identifier in the inspect result when the fixture contains addressable objects.",
        "Unsupported or partially parsed constructs appear as warnings or limitations."
      ],
      "evidence": ["inspect/*.json"],
      "automation": "required",
      "blocking": true
    },
    {
      "id": "A006",
      "title": "Preview artifact generation",
      "kind": "e2e",
      "requirementIds": ["G02-R02", "G02-R03"],
      "formats": ["pptx", "docx", "xlsx", "pdf", "svg"],
      "fixtures": ["representative pptx", "representative docx", "representative xlsx", "representative pdf"],
      "steps": [
        {
          "run": "officegen view <fixture> --format svg --out .officegen/acceptance/views/<name> --json",
          "expect": "View command reports generated artifacts, object-map overlay data, bytes, and warnings."
        }
      ],
      "passCriteria": [
        "Every declared output exists and has non-zero bytes.",
        "The view JSON links generated preview artifacts to source object context."
      ],
      "evidence": ["views/**/*.svg", "views/**/*.json", "views-sha256.txt"],
      "automation": "required",
      "blocking": true
    },
    {
      "id": "A007",
      "title": "Structured IR render matrix",
      "kind": "e2e",
      "requirementIds": ["G03-R01"],
      "formats": ["pptx", "docx", "xlsx", "pdf"],
      "fixtures": ["minimal IR per target", "business document IR per target"],
      "steps": [
        {
          "run": "officegen scaffold --kind <target> --title Acceptance --out <ir> --json",
          "expect": "Scaffold writes valid structured IR."
        },
        {
          "run": "officegen render <ir> --target <target> --out <output> --json",
          "expect": "Render writes output and reports artifact metadata."
        },
        {
          "run": "officegen verify <output> --json",
          "expect": "Generated output is openable according to available validators."
        }
      ],
      "passCriteria": [
        "Each target produces a non-empty output file.",
        "Verify has no blocking openability failure for generated outputs."
      ],
      "evidence": ["render/*.ir.json", "render/*.{pptx,docx,xlsx,pdf}", "render/verify/*.json"],
      "automation": "required",
      "blocking": true
    },
    {
      "id": "A008",
      "title": "Chart and diagram SVG rendering",
      "kind": "e2e",
      "requirementIds": ["G03-R02"],
      "formats": ["svg", "json"],
      "fixtures": ["bar chart spec", "line chart spec", "flow diagram spec", "invalid visual spec"],
      "steps": [
        {
          "run": "officegen chart render <chart-spec> --out <chart.svg> --json",
          "expect": "Chart SVG is written with structured success metadata."
        },
        {
          "run": "officegen diagram render <diagram-spec> --out <diagram.svg> --json",
          "expect": "Diagram SVG is written with structured success metadata."
        },
        {
          "run": "officegen chart render <invalid-spec> --out <bad.svg> --json",
          "expect": "Invalid input fails with a structured validation error."
        }
      ],
      "passCriteria": [
        "SVG outputs are non-empty and include expected root SVG markers.",
        "Invalid specs never produce silent success."
      ],
      "evidence": ["visuals/*.svg", "visuals/*.json"],
      "automation": "required",
      "blocking": true
    },
    {
      "id": "A009",
      "title": "Template design layout disclosure",
      "kind": "quality",
      "requirementIds": ["G03-R03"],
      "formats": ["pptx", "json"],
      "fixtures": ["branded deck", "layout-heavy deck"],
      "steps": [
        {
          "run": "officegen design capture <fixture> --out .officegen/acceptance/design/<name> --json",
          "expect": "Design capture records reusable design-pack artifacts and limitations."
        },
        {
          "run": "officegen layout <fixture> --json",
          "expect": "Layout command returns structured layout signals or explicit unsupported status."
        }
      ],
      "passCriteria": [
        "Best-effort design behavior includes limitations when fidelity is incomplete.",
        "Generated design artifacts are referenced in JSON output."
      ],
      "evidence": ["design/**/*.json", "layout/*.json"],
      "automation": "preferred",
      "blocking": false
    },
    {
      "id": "A010",
      "title": "Dry-run edit safety",
      "kind": "e2e",
      "requirementIds": ["G04-R01"],
      "formats": ["pptx", "docx", "xlsx", "pdf", "json"],
      "fixtures": ["edit source files", "selector-based edit operations"],
      "steps": [
        {
          "run": "officegen edit <fixture> --ops <ops.json> --dry-run --resolve-selectors --agent --json",
          "expect": "Dry-run reports resolved targets, planned mutations, warnings, and writes no output document."
        }
      ],